category,agentic_ceiling,agentic_confirmed,all_ceiling,all_confirmed,human_conversation,n_robust_configs,n_robust_configs_of,primary_tier
Present research or technical information.,65.90,65.84,74.52,70.06,63.21,0,,fragile
Program computer systems or production equipment.,80.43,79.98,81.42,70.69,66.13,0,,fragile
Gather information from physical or electronic sources.,67.91,67.91,78.74,70.70,66.74,0,,fragile
"Set up computer systems, networks, or other information systems.",81.29,81.24,82.28,71.55,62.82,0,,fragile
Resolve computer problems.,77.32,77.12,78.61,71.61,61.50,0,,fragile
"Prepare documentation for contracts, applications, or permits.",78.78,77.87,82.76,71.62,64.73,0,,fragile
"Provide information to guests, clients, or customers.",73.44,72.08,80.63,71.73,65.67,0,,fragile
Implement procedures or processes.,42.02,41.98,72.27,71.76,67.86,0,,fragile
Research biological or ecological phenomena.,53.80,53.80,72.57,71.94,57.74,0,,fragile
Maintain current knowledge in area of expertise.,51.23,51.22,73.06,72.04,58.75,0,,fragile
"Compile records, documentation, or other data.",73.82,73.56,79.64,72.51,67.72,0,,fragile
"Promote products, services, or programs.",65.11,59.28,76.20,72.71,62.25,0,,fragile
Implement security measures for computer or information systems.,86.16,86.16,86.17,72.78,55.09,0,,fragile
Consult legal materials or public records.,65.63,65.63,73.45,73.34,63.42,0,,fragile
Study details of artistic productions.,44.92,44.92,73.37,73.37,67.29,0,,fragile
Advise others on financial matters.,62.60,62.60,76.36,73.44,57.05,0,,fragile
Design computer or information systems or applications.,79.15,79.09,82.01,73.78,65.96,0,,fragile
"Evaluate programs, practices, or processes.",59.28,59.28,74.63,73.85,65.01,0,,fragile
Explain financial information.,69.78,69.69,77.94,74.51,61.92,0,,fragile
Respond to customer problems or inquiries.,67.05,65.35,78.39,75.18,68.08,0,,fragile
Advise others on products or services.,57.49,57.03,75.94,75.82,64.68,0,,fragile
Operate computer systems or computerized equipment.,86.25,86.25,87.19,76.50,64.33,0,,fragile
Analyze market or industry conditions.,82.74,82.61,83.52,76.51,66.82,0,,fragile
Prepare informational or instructional materials.,62.67,61.65,79.02,76.56,67.31,0,,fragile
Obtain information about goods or services.,70.57,69.69,78.95,77.84,70.36,0,,fragile
Edit written materials or documents.,79.82,79.50,81.21,77.87,66.85,0,,fragile
Analyze scientific or applied data using mathematical principles.,85.93,85.93,88.19,79.42,59.23,0,,fragile
Write material for artistic or commercial purposes.,82.02,80.75,84.43,81.32,61.37,0,,fragile
Explain technical details of products or services.,74.31,74.04,83.94,81.90,70.23,0,,fragile
"Interpret language, cultural, or religious information for others.",63.00,62.21,82.80,82.80,79.52,0,,fragile
Develop marketing or promotional materials.,73.85,73.77,86.03,85.16,75.16,0,,fragile
Evaluate scholarly work.,82.42,82.42,87.96,87.96,63.34,0,,fragile
Research historical or social issues.,66.26,66.26,89.14,89.14,69.76,0,,fragile
"Research laws, precedents, or other legal data.",88.47,88.47,92.52,92.52,83.12,0,,fragile
